URN,LA,EstablishmentName,TypeOfEstablishment,Gender,ReligiousCharacter,AdmissionsPolicy,SchoolCapacity,NumberOfPupils,PercentageFSM,TrustSchoolFlag,Full_Address,ParliamentaryConstituency,UrbanRural,localFSM,gap,cat
100049,Camden,Haverstock School,Community school,Mixed,Does not apply,Non-selective,1336.0,973.0,67.5,Not applicable,24 Haverstock Hill Chalk Farm  London  NW3 2BQ,Holborn and St Pancras,(England/Wales) Urban major conurbation,46.4,-21.1,very inclusive
100050,Camden,Parliament Hill School,Community school,Girls,Does not apply,Non-selective,1164.0,1218.0,35.8,Not applicable,Highgate Road   London  NW5 1RL,Hampstead and Highgate,(England/Wales) Urban major conurbation,37.9,2.1,broadly typical
100051,Camden,Regent High School,Community school,Mixed,Does not apply,Non-selective,1100.0,1076.0,63.2,Not applicable,Chalton Street Camden  London  NW1 1RX,Holborn and St Pancras,(England/Wales) Urban major conurbation,53.5,-9.7,more inclusive than most
100052,Camden,Hampstead School,Community school,Mixed,Does not apply,Non-selective,1320.0,1287.0,45.2,Not applicable,Westbere Road Hampstead  London  NW2 3RT,Hampstead and Highgate,(England/Wales) Urban major conurbation,31.4,-13.8,very inclusive
100053,Camden,Acland Burghley School,Community school,Mixed,Does not apply,Non-selective,1200.0,1166.0,34.9,Not applicable,Burghley Road   London  NW5 1UJ,Holborn and St Pancras,(England/Wales) Urban major conurbation,40.4,5.5,less inclusive than most
100054,Camden,The Camden School for Girls,Voluntary aided school,Girls,,Non-selective,1040.0,1068.0,28.1,Not applicable,Sandall Road   London  NW5 2DB,Holborn and St Pancras,(England/Wales) Urban major conurbation,48.8,20.7,among the least inclusive
100055,Camden,Maria Fidelis Catholic School FCJ,Voluntary aided school,Mixed,Roman Catholic,Non-selective,917.0,839.0,54.7,Not applicable,1 - 39 Drummond Crescent   London  NW1 1LY,Holborn and St Pancras,(England/Wales) Urban major conurbation,53.8,-0.9,broadly typical
100056,Camden,William Ellis School,Voluntary aided school,Boys,,Non-selective,895.0,879.0,44.8,Not applicable,Highgate Road   London  NW5 1RN,Hampstead and Highgate,(England/Wales) Urban major conurbation,37.1,-7.7,more inclusive than most
100059,Camden,La Sainte Union Catholic Secondary School,Voluntary aided school,Girls,Roman Catholic,Non-selective,1219.0,689.0,34.9,Not applicable,Highgate Road   London  NW5 1RP,Hampstead and Highgate,(England/Wales) Urban major conurbation,37.4,2.5,broadly typical
100182,Greenwich,Eltham Hill School,Community school,Girls,Does not apply,Non-selective,1050.0,1261.0,21.3,Not applicable,Eltham Hill   London  SE9 5EE,Eltham and Chislehurst,(England/Wales) Urban major conurbation,27.6,6.3,less inclusive than most
100183,Greenwich,Plumstead Manor School,Community school,Mixed,Does not apply,Non-selective,1500.0,1496.0,34.7,Not applicable,Old Mill Road   London  SE18 1QF,Erith and Thamesmead,(England/Wales) Urban major conurbation,31.2,-3.5,broadly typical
100190,Greenwich,Thomas Tallis School,Community school,Mixed,Does not apply,Non-selective,1950.0,2080.0,24.7,Not applicable,Kidbrooke Park Road   London  SE3 9PX,Eltham and Chislehurst,(England/Wales) Urban major conurbation,25.3,0.6,broadly typical
100193,Greenwich,St Ursula's Convent School,Voluntary aided school,Girls,Roman Catholic,Non-selective,675.0,637.0,22.0,Not applicable,Crooms Hill Greenwich  London  SE10 8HN,Greenwich and Woolwich,(England/Wales) Urban major conurbation,29.4,7.4,less inclusive than most
100279,Hackney,Stoke Newington School and Sixth Form,Community school,Mixed,Does not apply,Non-selective,1700.0,1666.0,33.9,Not applicable,Clissold Road  Hackney London  N16 9EX,Hackney North and Stoke Newington,(England/Wales) Urban major conurbation,29.6,-4.3,broadly typical
100282,Hackney,All Saints Catholic High School,Voluntary aided school,Mixed,Roman Catholic,Non-selective,756.0,531.0,49.9,Not applicable,6-16 Amhurst Park Stamford Hill  London  N16 5AF,Hackney North and Stoke Newington,(England/Wales) Urban major conurbation,35.8,-14.1,very inclusive
100284,Hackney,The Urswick School - A Church of England Secondary School,Voluntary aided school,Mixed,Church of England,Non-selective,1050.0,831.0,66.8,Not applicable,Paragon Road Hackney  London  E9 6NR,Hackney South and Shoreditch,(England/Wales) Urban major conurbation,43.8,-23.0,very inclusive
100453,Islington,Beacon High,Community school,Mixed,Does not apply,Non-selective,600.0,417.0,65.9,Not applicable,Hilldrop Road Islington  London  N7 0JG,Islington North,(England/Wales) Urban major conurbation,43.5,-22.4,very inclusive
100455,Islington,Highbury Fields School,Community school,Girls,Does not apply,Non-selective,1050.0,747.0,48.7,Not applicable,Highbury Hill   London  N5 1AR,Islington North,(England/Wales) Urban major conurbation,36.5,-12.2,very inclusive
100457,Islington,Elizabeth Garrett Anderson School,Community school,Girls,Does not apply,Non-selective,900.0,865.0,51.1,Not applicable,Donegal Street Islington  London  N1 9QG,Islington South and Finsbury,(England/Wales) Urban major conurbation,50.2,-0.9,broadly typical
100458,Islington,Central Foundation Boys' School,Voluntary aided school,Boys,,Non-selective,828.0,1132.0,40.1,Not applicable,Cowper Street City Road  London  EC2A 4SH,Islington South and Finsbury,(England/Wales) Urban major conurbation,46.9,6.8,less inclusive than most
100459,Islington,St Aloysius RC College,Voluntary aided school,Boys,Roman Catholic,Non-selective,1150.0,397.0,50.2,Not applicable,Hornsey Lane Highgate  London  N6 5LY,Islington North,(England/Wales) Urban major conurbation,32.2,-18.0,very inclusive
100503,Kensington and Chelsea,All Saints Catholic College,Voluntary aided school,Mixed,Catholic,Non-selective,870.0,828.0,41.2,Not applicable,75 St Charles Square   London  W10 6EL,Kensington and Bayswater,(England/Wales) Urban major conurbation,48.4,7.2,less inclusive than most
100624,Lambeth,The Norwood School,Community school,Mixed,Does not apply,Non-selective,900.0,1052.0,27.4,Not applicable,Crown Dale Lambeth  London  SE19 3NY,Dulwich and West Norwood,(England/Wales) Urban major conurbation,30.9,3.5,broadly typical
100625,Lambeth,Lilian Baylis Technology School,Community school,Mixed,Does not apply,Non-selective,900.0,844.0,58.3,Not applicable,323 Kennington Lane Kennington  London  SE11 5QY,Vauxhall and Camberwell Green,(England/Wales) Urban major conurbation,45.8,-12.5,very inclusive
100627,Lambeth,Saint Gabriel's College,Voluntary aided school,Mixed,Church of England,Non-selective,600.0,657.0,46.2,Not applicable,Langton Road   London  SW9 6UL,Vauxhall and Camberwell Green,(England/Wales) Urban major conurbation,44.1,-2.1,broadly typical
100637,Lambeth,La Retraite Roman Catholic Girls' School,Voluntary aided school,Girls,Roman Catholic,Non-selective,1140.0,1195.0,35.2,Not applicable,Atkins Road   London  SW12 0AB,Clapham and Brixton Hill,(England/Wales) Urban major conurbation,28.0,-7.2,more inclusive than most
100638,Lambeth,Bishop Thomas Grant Catholic Secondary School,Voluntary aided school,Mixed,Roman Catholic,Non-selective,1200.0,1175.0,20.4,Not applicable,Belltrees Grove   London  SW16 2HY,Streatham and Croydon North,(England/Wales) Urban major conurbation,29.7,9.3,less inclusive than most
100740,Lewisham,Deptford Green School,Community school,Mixed,Does not apply,Non-selective,900.0,895.0,41.4,Not applicable,Edward Street New Cross  London  SE14 6AN,Lewisham North,(England/Wales) Urban major conurbation,38.1,-3.3,broadly typical
100741,Lewisham,Sydenham School,Community school,Girls,Does not apply,Non-selective,1580.0,1445.0,25.4,Not applicable,Dartmouth Road   London  SE26 4RD,Lewisham West and East Dulwich,(England/Wales) Urban major conurbation,27.5,2.1,broadly typical
100745,Lewisham,Forest Hill School,Community school,Boys,Does not apply,Non-selective,1535.0,1093.0,25.6,Not applicable,Dacres Road Forest Hill  London  SE23 2XN,Lewisham West and East Dulwich,(England/Wales) Urban major conurbation,27.2,1.6,broadly typical
100748,Lewisham,Addey and Stanhope School,Voluntary aided school,Mixed,,Non-selective,600.0,591.0,44.7,Not applicable,472 New Cross Road New Cross  London  SE14 6TJ,Lewisham North,(England/Wales) Urban major conurbation,35.0,-9.7,more inclusive than most
100849,Southwark,St Saviour's and St Olave's Church of England School,Voluntary aided school,Girls,Church of England,Non-selective,825.0,738.0,39.8,Not applicable,New Kent Road   London  SE1 4AN,Bermondsey and Old Southwark,(England/Wales) Urban major conurbation,45.4,5.6,less inclusive than most
100857,Southwark,The St Thomas the Apostle College,Voluntary aided school,Boys,Roman Catholic,Non-selective,1000.0,1101.0,38.7,Not applicable,Hollydale Road Nunhead  London  SE15 2EB,Peckham,(England/Wales) Urban major conurbation,36.3,-2.4,broadly typical
100965,Tower Hamlets,Bow School,Community school,Mixed,Does not apply,Non-selective,1350.0,1267.0,45.8,Not applicable,44 Twelvetrees Crescent Bow  London  E3 3QW,Poplar and Limehouse,(England/Wales) Urban major conurbation,42.7,-3.1,broadly typical
100966,Tower Hamlets,Langdon Park Community School,Community school,Mixed,Does not apply,Non-selective,950.0,1076.0,60.5,Not applicable,Bright Street Poplar  London  E14 0RZ,Poplar and Limehouse,(England/Wales) Urban major conurbation,44.0,-16.5,very inclusive
100967,Tower Hamlets,Morpeth School,Community school,Mixed,Does not apply,Non-selective,1600.0,1524.0,47.2,Not applicable,Portman Place Bethnal Green  London  E2 0PX,Bethnal Green and Stepney,(England/Wales) Urban major conurbation,39.5,-7.7,more inclusive than most
100972,Tower Hamlets,Oaklands School,Community school,Mixed,Does not apply,Non-selective,1000.0,907.0,57.7,Not applicable,Old Bethnal Green Road Bethnal Green  London  E2 6PR,Bethnal Green and Stepney,(England/Wales) Urban major conurbation,43.0,-14.7,very inclusive
100973,Tower Hamlets,Swanlea School,Community school,Mixed,Does not apply,Non-selective,1260.0,1304.0,43.9,Not applicable,31 Brady Street Whitechapel  London  E1 5DJ,Bethnal Green and Stepney,(England/Wales) Urban major conurbation,39.9,-4.0,broadly typical
100974,Tower Hamlets,George Green's School,Voluntary controlled school,Mixed,,Non-selective,1239.0,1249.0,51.2,Not applicable,100 Manchester Road Isle of Dogs  London  E14 3DW,Poplar and Limehouse,(England/Wales) Urban major conurbation,30.8,-20.4,very inclusive
100975,Tower Hamlets,Central Foundation Girls' School,Voluntary aided school,Girls,,Non-selective,1550.0,1515.0,42.5,Not applicable,Bow Road   London  E3 2AE,Stratford and Bow,(England/Wales) Urban major conurbation,41.5,-1.0,broadly typical
100977,Tower Hamlets,Stepney All Saints Church of England Secondary School,Voluntary aided school,Mixed,Church of England,Non-selective,1540.0,1367.0,45.8,Not applicable,Stepney Way Stepney  London  E1 0RH,Bethnal Green and Stepney,(England/Wales) Urban major conurbation,38.1,-7.7,more inclusive than most
101154,Westminster,St Augustine's Federated Schools: CE High School,Voluntary aided school,Mixed,Church of England,Non-selective,1000.0,1002.0,55.3,Not applicable,Kilburn Park Road   London  NW6 5SN,Queen's Park and Maida Vale,(England/Wales) Urban major conurbation,42.4,-12.9,very inclusive
101241,Barking and Dagenham,"Barking Abbey School, A Specialist Sports and Humanities College",Community school,Mixed,Does not apply,Non-selective,2334.0,2323.0,25.0,Not applicable,Sandringham Road   Barking Essex IG11 9AG,Barking,(England/Wales) Urban major conurbation,22.0,-3.0,broadly typical
101247,Barking and Dagenham,All Saints Catholic School and Technology College,Voluntary aided school,Mixed,Roman Catholic,Non-selective,1520.0,1390.0,23.9,Not applicable,Terling Road Wood Lane  Dagenham Essex RM8 1JT,Dagenham and Rainham,(England/Wales) Urban major conurbation,28.1,4.2,broadly typical
101345,Barnet,Friern Barnet School,Community school,Mixed,Does not apply,Non-selective,810.0,716.0,36.7,Not applicable,Hemington Avenue Friern Barnet  London  N11 3LS,Hornsey and Friern Barnet,(England/Wales) Urban major conurbation,23.0,-13.7,very inclusive
101361,Barnet,St Michael's Catholic Grammar School,Voluntary aided school,Girls,Roman Catholic,Selective,940.0,856.0,10.8,Not applicable,Nether Street North Finchley  London  N12 7NJ,Finchley and Golders Green,(England/Wales) Urban major conurbation,18.1,7.3,less inclusive than most
101362,Barnet,Finchley Catholic High School,Voluntary aided school,Boys,Roman Catholic,Non-selective,1200.0,1198.0,12.3,Not applicable,Woodside Lane Finchley  London  N12 8TA,Chipping Barnet,(England/Wales) Urban major conurbation,17.6,5.3,less inclusive than most
101364,Barnet,St James' Catholic High School,Voluntary aided school,Mixed,Roman Catholic,Non-selective,1400.0,1253.0,24.2,Not applicable,Great Strand Colindale  London  NW9 5PE,Hendon,(England/Wales) Urban major conurbation,26.2,2.0,broadly typical
101564,Brent,Newman Catholic College,Voluntary aided school,Boys,Roman Catholic,Non-selective,1000.0,692.0,30.3,Not applicable,Harlesden Road Brent  London  NW10 3RN,Queen's Park and Maida Vale,(England/Wales) Urban major conurbation,31.5,1.2,broadly typical
101676,Bromley,St Olave's and St Saviour's Grammar School,Voluntary aided school,Boys,Church of England,Selective,838.0,1085.0,2.7,Not applicable,Goddington Lane   Orpington Kent BR6 9SH,Orpington,(England/Wales) Urban major conurbation,14.2,11.5,among the least inclusive
101811,Croydon,Archbishop Tenison's CofE High School,Voluntary aided school,Mixed,Church of England,Non-selective,800.0,760.0,32.7,Not applicable,Selborne Road   Croydon Surrey CR0 5JQ,Croydon South,(England/Wales) Urban major conurbation,28.7,-4.0,broadly typical
101814,Croydon,St Mary's Catholic High School,Voluntary aided school,Mixed,Roman Catholic,Non-selective,1115.0,579.0,39.9,Not applicable,Woburn Road   Croydon Surrey CR9 2EE,Croydon West,(England/Wales) Urban major conurbation,33.3,-6.6,more inclusive than most
101821,Croydon,Thomas More Catholic School,Voluntary aided school,Mixed,Roman Catholic,Non-selective,850.0,627.0,34.0,Not applicable,Russell Hill Road   Purley Surrey CR8 2XP,Croydon South,(England/Wales) Urban major conurbation,22.9,-11.1,very inclusive
101928,Ealing,Villiers High School,Foundation school,Mixed,,Non-selective,1500.0,1498.0,34.6,Not supported by a trust,Boyd Avenue   Southall Middlesex UB1 3BT,Ealing Southall,(England/Wales) Urban major conurbation,29.0,-5.6,more inclusive than most
101934,Ealing,The Cardinal Wiseman Catholic School,Voluntary aided school,Mixed,Roman Catholic,Non-selective,1865.0,1985.0,14.1,Not applicable,Greenford Road   Greenford Middlesex UB6 9AW,Ealing North,(England/Wales) Urban major conurbation,30.7,16.6,among the least inclusive
101939,Ealing,Brentside High School,Foundation school,Mixed,,Non-selective,1600.0,1669.0,40.9,Not supported by a trust,Greenford Avenue Hanwell  London  W7 1JJ,Ealing North,(England/Wales) Urban major conurbation,31.6,-9.3,more inclusive than most
101940,Ealing,Greenford High School,Foundation school,Mixed,,Non-selective,1800.0,2015.0,35.1,Not supported by a trust,Lady Margaret Road   Southall Middlesex UB1 2GU,Ealing Southall,(England/Wales) Urban major conurbation,32.9,-2.2,broadly typical
101941,Ealing,The Ellen Wilkinson School for Girls,Foundation school,Girls,,Non-selective,1480.0,1306.0,29.9,Not supported by a trust,Queen's Drive Acton  London  W3 0HW,Ealing Central and Acton,(England/Wales) Urban major conurbation,24.6,-5.3,more inclusive than most
101943,Ealing,Northolt High School,Foundation school,Mixed,,Non-selective,1100.0,974.0,34.8,Not supported by a trust,Eastcote Lane   Northolt Middlesex UB5 4HP,Ealing North,(England/Wales) Urban major conurbation,28.2,-6.6,more inclusive than most
102045,Enfield,Winchmore School,Community school,Mixed,Does not apply,Non-selective,1433.0,1746.0,23.4,Not applicable,Laburnum Grove Winchmore Hill  London  N21 3HS,Edmonton and Winchmore Hill,(England/Wales) Urban major conurbation,25.5,2.1,broadly typical
102048,Enfield,Enfield County School for Girls,Community school,Girls,Does not apply,Non-selective,1167.0,1064.0,31.3,Not applicable,Holly Walk   Enfield  EN2 6QG,Enfield North,(England/Wales) Urban major conurbation,24.1,-7.2,more inclusive than most
102049,Enfield,Chace Community School,Community school,Mixed,Does not apply,Non-selective,1000.0,1031.0,33.6,Not applicable,Churchbury Lane   Enfield  EN1 3HQ,Enfield North,(England/Wales) Urban major conurbation,26.0,-7.6,more inclusive than most
102052,Enfield,Bishop Stopford's School,Voluntary aided school,Mixed,Church of England,Non-selective,1165.0,727.0,41.8,Not applicable,Brick Lane   Enfield Middlesex EN1 3PU,Enfield North,(England/Wales) Urban major conurbation,39.8,-2.0,broadly typical
102053,Enfield,St Anne's Catholic High School for Girls,Voluntary aided school,Girls,Roman Catholic,Non-selective,1056.0,1019.0,25.2,Not applicable,Oakthorpe Road Palmers Green  London  N13 5TY,Southgate and Wood Green,(England/Wales) Urban major conurbation,24.0,-1.2,broadly typical
102055,Enfield,The Latymer School,Voluntary aided school,Mixed,,Selective,1438.0,1380.0,7.5,Not applicable,Haselbury Road   London  N9 9TN,Edmonton and Winchmore Hill,(England/Wales) Urban major conurbation,34.3,26.8,among the least inclusive
102056,Enfield,Laurel Park School,Foundation school,Mixed,,Non-selective,800.0,613.0,38.2,Not supported by a trust,Wilmer Way   London  N14 7HY,Southgate and Wood Green,(England/Wales) Urban major conurbation,19.8,-18.4,very inclusive
102058,Enfield,St Ignatius College,Voluntary aided school,Boys,Roman Catholic,Non-selective,1229.0,1064.0,29.7,Not applicable,Turkey Street   Enfield  EN1 4NP,Enfield North,(England/Wales) Urban major conurbation,39.5,9.8,less inclusive than most
102153,Haringey,Hornsey School for Girls,Community school,Girls,Does not apply,Non-selective,810.0,719.0,28.8,Not applicable,Inderwick Road   London  N8 9JF,Hornsey and Friern Barnet,(England/Wales) Urban major conurbation,21.8,-7.0,more inclusive than most
102154,Haringey,Highgate Wood Secondary School,Community school,Mixed,Does not apply,Non-selective,1465.0,1554.0,18.2,Not applicable,Montenotte Road   London  N8 8RN,Hornsey and Friern Barnet,(England/Wales) Urban major conurbation,18.3,0.1,broadly typical
102156,Haringey,Fortismere School,Foundation school,Mixed,,Non-selective,1655.0,1808.0,11.6,Not supported by a trust,Southwing Tetherdown Muswell Hill London  N10 1NE,Hornsey and Friern Barnet,(England/Wales) Urban major conurbation,14.0,2.4,broadly typical
102157,Haringey,Gladesmore Community School,Community school,Mixed,Does not apply,Non-selective,1215.0,1281.0,48.2,Not applicable,Crowland Road Tottenham  London  N15 6EB,Tottenham,(England/Wales) Urban major conurbation,36.5,-11.7,very inclusive
102239,Harrow,Whitmore High School,Community school,Mixed,Does not apply,Non-selective,1750.0,1733.0,28.9,Not applicable,Porlock Avenue   Harrow  HA2 0AD,Harrow West,(England/Wales) Urban major conurbation,19.6,-9.3,more inclusive than most
102449,Hillingdon,Oak Wood School,Foundation school,Mixed,,Non-selective,1350.0,1247.0,33.7,Not supported by a trust,Sutton Court Road Hillingdon  Uxbridge Middlesex UB10 9HT,Uxbridge and South Ruislip,(England/Wales) Urban major conurbation,21.2,-12.5,very inclusive
102451,Hillingdon,Harlington School,Foundation school,Mixed,,Non-selective,1156.0,1317.0,40.5,Not supported by a trust,Pinkwell Lane Harlington  Hayes  UB3 1PB,Hayes and Harlington,(England/Wales) Urban major conurbation,30.2,-10.3,more inclusive than most
102539,Hounslow,The Heathland School,Community school,Mixed,Does not apply,Non-selective,1679.0,1863.0,26.7,Not applicable,Wellington Road South   Hounslow  TW4 5JD,Brentford and Isleworth,(England/Wales) Urban major conurbation,19.3,-7.4,more inclusive than most
102545,Hounslow,Gunnersbury Catholic School,Voluntary aided school,Boys,Roman Catholic,Non-selective,1228.0,1204.0,14.2,Not applicable,The Ride Boston Manor Road  Brentford  TW8 9LB,Brentford and Isleworth,(England/Wales) Urban major conurbation,17.6,3.4,broadly typical
102673,Merton,Ricards Lodge High School,Community school,Girls,Does not apply,Non-selective,1500.0,1402.0,22.8,Not applicable,Lake Road Wimbledon  London  SW19 7HB,Wimbledon,(England/Wales) Urban major conurbation,14.6,-8.2,more inclusive than most
102674,Merton,Raynes Park High School,Community school,Mixed,Does not apply,Non-selective,1440.0,1207.0,37.4,Not applicable,Bushey Road   London  SW20 0JL,Wimbledon,(England/Wales) Urban major conurbation,18.9,-18.5,very inclusive
102679,Merton,Rutlish School,Voluntary controlled school,Boys,,Non-selective,1500.0,1477.0,20.8,Not applicable,Watery Lane Merton Park  London  SW20 9AD,Wimbledon,(England/Wales) Urban major conurbation,17.0,-3.8,broadly typical
102681,Merton,Wimbledon College,Voluntary aided school,Boys,Roman Catholic,Non-selective,1249.0,1248.0,18.1,Not applicable,Edge Hill   London  SW19 4NS,Wimbledon,(England/Wales) Urban major conurbation,13.1,-5.0,broadly typical
102776,Newham,Little Ilford School,Community school,Mixed,Does not apply,Non-selective,1740.0,1641.0,39.7,Not applicable,Rectory Road Manor Park  London  E12 6JB,East Ham,(England/Wales) Urban major conurbation,30.0,-9.7,more inclusive than most
102782,Newham,Plashet School,Community school,Girls,Does not apply,Non-selective,1500.0,1487.0,36.2,Not applicable,Plashet Grove East Ham  London  E6 1DG,East Ham,(England/Wales) Urban major conurbation,30.3,-5.9,more inclusive than most
102786,Newham,St Angela's Ursuline School,Voluntary aided school,Girls,Roman Catholic,Non-selective,1344.0,1297.0,32.8,Not applicable,St George's Road Forest Gate  London  E7 8HU,Stratford and Bow,(England/Wales) Urban major conurbation,28.9,-3.9,broadly typical
102787,Newham,St Bonaventure's RC School,Voluntary aided school,Boys,Roman Catholic,Non-selective,1300.0,1344.0,34.0,Not applicable,Boleyn Road Forest Gate  London  E7 9QD,Stratford and Bow,(England/Wales) Urban major conurbation,30.1,-3.9,broadly typical
102849,Redbridge,Caterham High School,Community school,Mixed,Does not apply,Non-selective,1182.0,986.0,35.4,Not applicable,Caterham Avenue Clayhall  Ilford Essex IG5 0QW,Ilford North,(England/Wales) Urban major conurbation,15.0,-20.4,very inclusive
102850,Redbridge,Ilford County High School,Community school,Boys,Does not apply,Selective,850.0,1138.0,9.5,Not applicable,Fremantle Road Barkingside  Ilford Essex IG6 2JB,Ilford North,(England/Wales) Urban major conurbation,14.6,5.1,less inclusive than most
102851,Redbridge,Wanstead High School,Community school,Mixed,Does not apply,Non-selective,1500.0,1469.0,15.9,Not applicable,Redbridge Lane West Wanstead  London  E11 2JZ,Leyton and Wanstead,(England/Wales) Urban major conurbation,14.0,-1.9,broadly typical
102852,Redbridge,Woodford County High School,Community school,Girls,Does not apply,Selective,1260.0,1238.0,10.5,Not applicable,High Road   Woodford Green Essex IG8 9LA,Chingford and Woodford Green,(England/Wales) Urban major conurbation,17.5,7.0,less inclusive than most
102854,Redbridge,Woodbridge High School,Community school,Mixed,Does not apply,Non-selective,2000.0,1927.0,18.5,Not applicable,St Barnabas Road   Woodford Green Essex IG8 7DQ,Chingford and Woodford Green,(England/Wales) Urban major conurbation,14.2,-4.3,broadly typical
102857,Redbridge,Valentines High School,Community school,Mixed,Does not apply,Non-selective,1288.0,1349.0,20.1,Not applicable,Cranbrook Road   Ilford Essex IG2 6HX,Ilford North,(England/Wales) Urban major conurbation,15.6,-4.5,broadly typical
102858,Redbridge,Mayfield School,Foundation school,Mixed,,Non-selective,1940.0,1897.0,29.3,Not supported by a trust,Pedley Road   Dagenham Essex RM8 1XE,Ilford South,(England/Wales) Urban major conurbation,21.5,-7.8,more inclusive than most
102860,Redbridge,Trinity Catholic High School,Voluntary aided school,Mixed,Roman Catholic,Non-selective,1579.0,1626.0,12.2,Not applicable,Mornington Road   Woodford Green Essex IG8 0TP,Chingford and Woodford Green,(England/Wales) Urban major conurbation,13.9,1.7,broadly typical
102861,Redbridge,King Solomon High School,Voluntary aided school,Mixed,Jewish,Non-selective,1160.0,1000.0,22.5,Not applicable,Forest Road Barkingside  Ilford Essex IG6 3HB,Ilford North,(England/Wales) Urban major conurbation,14.6,-7.9,more inclusive than most
102929,Richmond upon Thames,Christ's Church of England Comprehensive Secondary School,Voluntary aided school,Mixed,Church of England,Non-selective,930.0,1048.0,18.5,Not applicable,Queens Road   Richmond Surrey TW10 6HW,Richmond Park,(England/Wales) Urban major conurbation,10.5,-8.0,more inclusive than most
103009,Sutton,The John Fisher School,Voluntary aided school,Boys,Roman Catholic,Non-selective,1190.0,1154.0,13.7,Not applicable,Peaks Hill   Purley Surrey CR8 3YP,Carshalton and Wallington,(England/Wales) Urban major conurbation,22.1,8.4,less inclusive than most
103013,Sutton,St Philomena's Catholic High School for Girls,Voluntary aided school,Girls,Roman Catholic,Non-selective,1549.0,1462.0,15.9,Not applicable,Shorts Road   Carshalton Surrey SM5 3PS,Carshalton and Wallington,(England/Wales) Urban major conurbation,15.8,-0.1,broadly typical
103094,Waltham Forest,Frederick Bremer School,Community school,Mixed,Does not apply,Non-selective,900.0,880.0,31.0,Not applicable,Siddeley Road Walthamstow  London  E17 4EY,Walthamstow,(England/Wales) Urban major conurbation,26.1,-4.9,broadly typical
103097,Waltham Forest,Heathcote School & Science College,Community school,Mixed,Does not apply,Non-selective,1260.0,1117.0,27.4,Not applicable,Normanton Park Chingford  London  E4 6ES,Chingford and Woodford Green,(England/Wales) Urban major conurbation,18.7,-8.7,more inclusive than most
